{"admissibility_decision_contract":{"decision_inputs":["evidence role","epistemic use","requested conclusion","oracle compatibility","normative strength","semantic scope","immutable provenance","dependency independence","quality eligibility"],"decision_states":["admissible","inadmissible"],"fail_closed":true,"scope_must_be_covered":true,"unknown_or_incomplete_never_elevates":true},"authority_domain_contract":{"deep_dependency_traversal_required":true,"independent_domain_count_rule":"Count unique authority domains over all reachable expected-basis dependencies after collapsing wrappers and transformed mirrors to their upstream semantic authority.","shared_upstream_is_shared_authority":true,"wrapper_independence_forbidden":true},"authority_scope":"Prospective evidence-role and epistemic-use admissibility for exact semantic requirements. No profile applicability decision, discrepancy adjudication, waiver, claim issuance, observation rewrite, or production vector is created here.","contract_digest_sha256":"37bac8b2b69a906d1008fd2cb21cb38bc81cca3a5f952cc0ad394475318bbe02","contract_id":"rcid:v1:trust-policy-revision:h:jcs-sha256-v1:a6414c91a3a1fe0e6b24594ad4217c911739c520e417640b09a94362a423ef39","contract_version":"1.0.0","derivation":{"derivation_class":"manual-decision","derivation_id":"rcid:v1:assertion-derivation:u7:01a08d9e-ab75-762b-8a10-90db25ccb8fb","derivation_revision_id":"rcid:v1:assertion-derivation-revision:h:jcs-sha256-v1:8b15d22cdd8ad1853cdc390ad87ebc908a6d0cc239ba95765d9a594a2d53b8d5"},"effective_on":"2026-09-10","epistemic_uses":[{"admissible_evidence_roles":["normative-source-evidence"],"correctness_establishing":true,"epistemic_use":"establish-normative-expectation","independence_required":true,"meaning":"Establish the exact externally normative expectation selected by applicable source language.","permitted_conclusions":["normative-required-expectation","normative-prohibited-expectation","normative-permission","normative-optionality","normative-conditional-expectation","normative-ambiguity-recorded","normative-under-specification-recorded"]},{"admissible_evidence_roles":["formal-derivation-evidence"],"correctness_establishing":true,"epistemic_use":"establish-formal-model-expectation","independence_required":true,"meaning":"Establish a result within an explicit independent formal model.","permitted_conclusions":["formal-model-expectation","formal-model-satisfied","formal-model-violated"]},{"admissible_evidence_roles":["authoritative-data-derived-evidence"],"correctness_establishing":true,"epistemic_use":"establish-data-scoped-expectation","independence_required":true,"meaning":"Establish a result scoped to pinned authoritative data and an established semantic rule.","permitted_conclusions":["data-scoped-expectation","data-scoped-agreement","data-scoped-disagreement"]},{"admissible_evidence_roles":["relational-metamorphic-evidence"],"correctness_establishing":false,"epistemic_use":"evaluate-metamorphic-relation","independence_required":false,"meaning":"Evaluate a necessary relation without promoting relation satisfaction into full correctness.","permitted_conclusions":["relation-violation-defect","relation-satisfied-only"]},{"admissible_evidence_roles":["family-relative-reference-evidence"],"correctness_establishing":false,"epistemic_use":"establish-family-relative-comparison","independence_required":false,"meaning":"Establish equivalence, divergence, regression, or change only within one family-relative scope.","permitted_conclusions":["family-relative-equivalence","family-relative-divergence","family-relative-regression","family-relative-change"]},{"admissible_evidence_roles":["implementation-documentation-evidence"],"correctness_establishing":true,"epistemic_use":"establish-implementation-documentation-expectation","independence_required":true,"meaning":"Establish what one exact implementation documents about itself.","permitted_conclusions":["implementation-documented-expectation","implementation-documentation-ambiguous","implementation-documentation-incomplete"]},{"admissible_evidence_roles":["historical-empirical-evidence"],"correctness_establishing":false,"epistemic_use":"establish-historical-fact","independence_required":false,"meaning":"Establish an exact historical empirical fact, never a normative expectation.","permitted_conclusions":["historical-fact-recorded","historical-behavior-reproduced","historical-behavior-diverged"]},{"admissible_evidence_roles":["historical-empirical-evidence","characterization-only-evidence"],"correctness_establishing":false,"epistemic_use":"establish-characterization","independence_required":false,"meaning":"Record characterization, descriptive differential, or research-gap evidence.","permitted_conclusions":["characterization-recorded","descriptive-differential","research-gap-recorded"]},{"admissible_evidence_roles":["normative-source-evidence","formal-derivation-evidence","authoritative-data-derived-evidence","relational-metamorphic-evidence","family-relative-reference-evidence","implementation-documentation-evidence","historical-empirical-evidence","characterization-only-evidence"],"correctness_establishing":false,"epistemic_use":"support-discrepancy-investigation","independence_required":false,"meaning":"Provide independently preserved context for later discrepancy investigation without adjudicating it.","permitted_conclusions":["discrepancy-investigation-input"]},{"admissible_evidence_roles":["normative-source-evidence","formal-derivation-evidence","authoritative-data-derived-evidence","relational-metamorphic-evidence","family-relative-reference-evidence","implementation-documentation-evidence","historical-empirical-evidence","characterization-only-evidence"],"correctness_establishing":false,"epistemic_use":"support-research-revision","independence_required":false,"meaning":"Motivate later researched revision without becoming that revision's authority by itself.","permitted_conclusions":["research-revision-input"]}],"evidence_roles":[{"conclusion_boundary":"Only mandatory, prohibitive, permissive, optional, or conditional normative language can establish its corresponding scoped expectation; informative, ambiguous, unspecified, or silent material cannot.","epistemic_function":"Preserves an exact proposition from an explicitly normative source for its exact governed scope.","evidence_role":"normative-source-evidence","expectation_bearing":true,"oracle_class":"O1","permitted_conclusions":["normative-required-expectation","normative-prohibited-expectation","normative-permission","normative-optionality","normative-conditional-expectation","normative-ambiguity-recorded","normative-under-specification-recorded","discrepancy-investigation-input","research-revision-input"],"potentially_admitted_uses":["establish-normative-expectation","support-discrepancy-investigation","support-research-revision"],"required_provenance_fields":["proposition_revision_id","retrieval_snapshot_id","semantic_authority","source_identity","source_revision","source_snapshot_digest_sha256","stable_locator"]},{"conclusion_boundary":"A program output is formal evidence only when the model, assumptions, inputs, subset, method, output, and independent check are pinned and independent of the evaluated target.","epistemic_function":"Preserves an independently checkable result within an exact formal model and admitted semantic subset.","evidence_role":"formal-derivation-evidence","expectation_bearing":true,"oracle_class":"O2","permitted_conclusions":["formal-model-expectation","formal-model-satisfied","formal-model-violated","discrepancy-investigation-input","research-revision-input"],"potentially_admitted_uses":["establish-formal-model-expectation","support-discrepancy-investigation","support-research-revision"],"required_provenance_fields":["admitted_semantic_subset","assumptions","derivation_method_identity","derivation_method_version","derivation_output_digest_sha256","formal_model_identity","formal_model_version","independent_checker_identities","input_identities"]},{"conclusion_boundary":"Neither a data table nor an algorithm alone establishes regex semantics; pinned data, an independent semantic rule, and the deterministic derivation are all required.","epistemic_function":"Combines pinned authoritative data with an established semantic rule and deterministic derivation.","evidence_role":"authoritative-data-derived-evidence","expectation_bearing":true,"oracle_class":"O3","permitted_conclusions":["data-scoped-expectation","data-scoped-agreement","data-scoped-disagreement","discrepancy-investigation-input","research-revision-input"],"potentially_admitted_uses":["establish-data-scoped-expectation","support-discrepancy-investigation","support-research-revision"],"required_provenance_fields":["algorithm_identity","algorithm_version","dataset_digest_sha256","dataset_identity","dataset_version","derivation_output_digest_sha256","semantic_rule_revision_id"]},{"conclusion_boundary":"Violation of a valid necessary relation may establish a relational defect; satisfaction establishes only the relation and never full correctness.","epistemic_function":"Evaluates a necessary relation among exact executions of the same applicable profile.","evidence_role":"relational-metamorphic-evidence","expectation_bearing":false,"oracle_class":"O4","permitted_conclusions":["relation-violation-defect","relation-satisfied-only","discrepancy-investigation-input","research-revision-input"],"potentially_admitted_uses":["evaluate-metamorphic-relation","support-discrepancy-investigation","support-research-revision"],"required_provenance_fields":["directionality","execution_ids","gating_assumptions","relation_identity","relation_semantics","relation_version","satisfaction_establishes_full_correctness","violation_sufficient_for_relational_defect"]},{"conclusion_boundary":"A designated reference is family-relative evidence, not independent correctness authority and never universal truth.","epistemic_function":"Compares e